{"claim_adjudicated":true,"claim_track":"BLIND","eligibility_manifest_hash":"81b5874fe6a86e1ef15c41b030937d66d1c282f343de86e830fef55cda530fd5","experiment_id":"EZ-B002-v2-real-blind","prediction_seal_hash":"cf6303efae1dd275e810154503e7ca1ba883b8ab3f24bda901b4cbaded45bf85","protocol_hash":"117b60ccfbde52a3eef1e5e5acdeae8197275d073d122752a8b75b33500cd686","run_id":"wo14-EZ-B002-v2-real-blind-run-v1","state":"CLAIM_ADJUDICATED","truth_unlocked":true}
