{"claim_adjudicated":true,"claim_track":"BLIND","eligibility_manifest_hash":"63c3ff000edf1935c2b00dc0a9b5dbbf87f6705bccfa4f80a55c110a99af14e4","experiment_id":"EZ-B003-v2-real-blind","prediction_seal_hash":"eb0a3dd4169695a94f187984546323f76d9b955d60dc081cfccbfe76644625d6","protocol_hash":"117b60ccfbde52a3eef1e5e5acdeae8197275d073d122752a8b75b33500cd686","run_id":"wo14-EZ-B003-v2-real-blind-run-v1","state":"CLAIM_ADJUDICATED","truth_unlocked":true}
