{"claim_adjudicated":false,"claim_track":"RECONSTRUCTION","eligibility_manifest_hash":"c99bf60783173a68d4e0cccce9fb263bdf753910be7ee3da2404230a00a8ad21","experiment_id":"EZ-B002-v2-real-recon","prediction_seal_hash":"c337229e682e8aa9f6b4f3ad0298d639907e8429b38bc527f2bb565cf6b09907","protocol_hash":"117b60ccfbde52a3eef1e5e5acdeae8197275d073d122752a8b75b33500cd686","run_id":"wo14-EZ-B002-v2-real-recon-run-v1","state":"PREDICTIONS_FINALIZED","truth_unlocked":false}
