{"claim_adjudicated":false,"claim_track":"RECONSTRUCTION","eligibility_manifest_hash":"df53ae0cb1fa93c5fb032bee5cec24954fc6790c18bb709bce15e3fc72ba4854","experiment_id":"EZ-B003-v2-real-recon","prediction_seal_hash":"9a59e12349a6ebcc8266896ca40799c818d884cbe384684db37d78755fa36569","protocol_hash":"117b60ccfbde52a3eef1e5e5acdeae8197275d073d122752a8b75b33500cd686","run_id":"wo14-EZ-B003-v2-real-recon-run-v1","state":"PREDICTIONS_FINALIZED","truth_unlocked":false}
